<?xml version="1.0" encoding="ISO-8859-1"?>

<!-- 
    * Copyright (c) 2018 Airbus Operations S.A.S                                  *
    *                                                                             *
    * This program and the accompanying materials are made available under the    *
    * terms of the Eclipse Public License v. 2.0 which is available at            *
    * http://www.eclipse.org/legal/epl-2.0, or the Eclipse Distribution License   *
    * v. 1.0 which is available at                                                *
    * http://www.eclipse.org/org/documents/edl-v10.php.                           *
    *                                                                             *
    * SPDX-License-Identifier: EPL-2.0 OR BSD-3-Clause                            *
-->

<Network xmlns:xsi="http://www.w3.org/2001/XMLSchema-instance" xsi:noNamespaceSchemaLocation="vistas_config.xsd">
  <VirtualComponent Name="testVirtualComponent">
    <A664_Channel Name="firstEquipment_firstApplication_AFDX_IN_oneAFDX" Direction="In" MessageMaxSize="42" FifoSize="1">
      <Socket DstIP="226.23.12.4" DstPort="5078" />
      <Header Src_Id="No" SN="No" QoS_Timestamp="No" Data_Timestamp="No" />
    </A664_Channel>
    <A664_Channel Name="firstEquipment_firstApplication_AFDX_IN_smallAFDX" Direction="In" MessageMaxSize="10" FifoSize="1">
      <Socket DstIP="226.23.12.4" DstPort="5079" />
      <Header Src_Id="No" SN="No" QoS_Timestamp="No" Data_Timestamp="No" />
    </A664_Channel>
    <A429_Channel Name="firstEquipment_firstApplication_A429_IN_bus1" Direction="In" MessageMaxSize="8" FifoSize="1">
      <Socket DstIP="226.23.12.4" DstPort="5080" />
      <Header Src_Id="No" SN="No" QoS_Timestamp="No" Data_Timestamp="No" />
    </A429_Channel>
    <A825_Channel Name="firstEquipment_firstApplication_CAN_IN_bus1" Direction="In" MessageMaxSize="28" FifoSize="1">
      <Socket DstIP="226.23.12.4" DstPort="5081" />
      <Header Src_Id="No" SN="No" QoS_Timestamp="No" Data_Timestamp="No" />
    </A825_Channel>
  </VirtualComponent>
</Network>
